chunk_id,doc_id,text
GCH_1,DOC_IRB_1,"Article 180 — IRB approach: PD, LGD and EAD calibration reflect downturn conditions."
GCH_2,DOC_IRB_2,Annex — IRB slotting; supervisory mapping; downturn LGD in parameter estimation.
GCH_3,DOC_LCR_1,Liquidity Coverage Ratio (LCR): institutions shall hold HQLA to cover 30 days of stress.
GCH_4,DOC_LCR_2,Template C 73.00: HQLA composition and outflow assumptions.
GCH_5,DOC_AML_1,"AML and KYC: customer due diligence (CDD), ongoing monitoring, PEP EDD."
GCH_6,DOC_SEC_1,Securitisation: significant risk transfer (SRT) tests; STS criteria.
GCH_7,DOC_LR_1,Leverage Ratio: exposure measure includes derivatives and CCFs.
